[
  {
    "id": "GT-41110-B01-birth-2nd",
    "unitId": "lg-41110",
    "questionId": "V1-B01-01",
    "category": "birth",
    "value": "100만원",
    "valueType": "numeric",
    "acceptableVariants": ["100만", "1000000", "백만", "100만원"],
    "sourceUrl": "https://www.suwon.go.kr",
    "sourceOrg": "수원시청",
    "verifiedAt": "2026-09-07",
    "verifiedBy": "human",
    "validFrom": "2026-01-01",
    "validUntil": "2026-12-31",
    "updateFrequency": "annual",
    "status": "active"
  },
  {
    "id": "GT-41110-B01-postpartum-care",
    "unitId": "lg-41110",
    "questionId": "V1-B01-02",
    "category": "birth",
    "value": "50만원",
    "valueType": "numeric",
    "acceptableVariants": ["50만", "500000", "오십만", "50만원"],
    "sourceUrl": "https://www.suwon.go.kr",
    "sourceOrg": "수원시청",
    "verifiedAt": "2026-09-07",
    "verifiedBy": "human",
    "validFrom": "2026-01-01",
    "validUntil": "2026-12-31",
    "updateFrequency": "annual",
    "status": "active"
  },
  {
    "id": "GT-41110-B01-birth-1st",
    "unitId": "lg-41110",
    "questionId": "V1-B01-03",
    "category": "birth",
    "value": "30만원",
    "valueType": "numeric",
    "acceptableVariants": ["30만", "300000", "삼십만", "30만원"],
    "sourceUrl": "https://www.suwon.go.kr",
    "sourceOrg": "수원시청",
    "verifiedAt": "2026-09-07",
    "verifiedBy": "human",
    "validFrom": "2026-01-01",
    "validUntil": "2026-12-31",
    "updateFrequency": "annual",
    "status": "active"
  },
  {
    "id": "GT-41110-B04-waste-20l",
    "unitId": "lg-41110",
    "questionId": "V1-B04-01",
    "category": "waste_bag",
    "value": "590원",
    "valueType": "numeric",
    "acceptableVariants": ["590", "590원", "오백구십원"],
    "sourceUrl": "https://www.suwon.go.kr",
    "sourceOrg": "수원시청",
    "verifiedAt": "2026-09-07",
    "verifiedBy": "human",
    "validFrom": "2026-01-01",
    "validUntil": "2026-12-31",
    "updateFrequency": "annual",
    "status": "active"
  },
  {
    "id": "GT-41110-B04-food-waste-2l",
    "unitId": "lg-41110",
    "questionId": "V1-B04-02",
    "category": "waste_bag",
    "value": "160원",
    "valueType": "numeric",
    "acceptableVariants": ["160", "160원", "백육십원"],
    "sourceUrl": "https://www.suwon.go.kr",
    "sourceOrg": "수원시청",
    "verifiedAt": "2026-09-07",
    "verifiedBy": "human",
    "validFrom": "2026-01-01",
    "validUntil": "2026-12-31",
    "updateFrequency": "annual",
    "status": "active"
  },
  {
    "id": "GT-41110-B04-retailers",
    "unitId": "lg-41110",
    "questionId": "V1-B04-03",
    "category": "waste_bag",
    "value": "편의점, 마트, 동 행정복지센터",
    "valueType": "text",
    "acceptableVariants": [
      "편의점·마트·주민센터",
      "편의점, 마트, 주민센터",
      "종량제봉투 지정판매소(마트, 편의점)",
      "행정복지센터, 마트, 편의점",
      "편의점, 마트"
    ],
    "sourceUrl": "https://www.suwon.go.kr",
    "sourceOrg": "수원시청",
    "verifiedAt": "2026-09-07",
    "verifiedBy": "human",
    "validFrom": "2026-01-01",
    "validUntil": "2026-12-31",
    "updateFrequency": "annual",
    "status": "active"
  },
  {
    "id": "GT-41110-B06-senior-age",
    "unitId": "lg-41110",
    "questionId": "V1-B06-01",
    "category": "senior_bus",
    "value": "만 65세 이상",
    "valueType": "numeric",
    "acceptableVariants": ["만 65세", "만65세", "65세", "65세 이상", "만 65세 이상"],
    "sourceUrl": "https://www.suwon.go.kr",
    "sourceOrg": "수원시청",
    "verifiedAt": "2026-09-07",
    "verifiedBy": "human",
    "validFrom": "2026-01-01",
    "validUntil": "2026-12-31",
    "updateFrequency": "annual",
    "status": "active"
  },
  {
    "id": "GT-41110-B06-senior-bus-allowance",
    "unitId": "lg-41110",
    "questionId": "V1-B06-02",
    "category": "senior_bus",
    "value": "월 1만원",
    "valueType": "numeric",
    "acceptableVariants": ["월 1만원", "월 1만", "1만원", "10000원", "월1만원", "연 12만원", "분기 3만원"],
    "sourceUrl": "https://www.suwon.go.kr",
    "sourceOrg": "수원시청",
    "verifiedAt": "2026-09-07",
    "verifiedBy": "human",
    "validFrom": "2026-01-01",
    "validUntil": "2026-12-31",
    "updateFrequency": "annual",
    "status": "active"
  },
  {
    "id": "GT-41110-B08-youth-rent-amount",
    "unitId": "lg-41110",
    "questionId": "V1-B08-01",
    "category": "youth_rent",
    "value": "월 20만원",
    "valueType": "numeric",
    "acceptableVariants": ["월 20만원", "월20만원", "20만원", "200000원", "월 최대 20만원"],
    "sourceUrl": "https://www.suwon.go.kr",
    "sourceOrg": "수원시청",
    "verifiedAt": "2026-09-07",
    "verifiedBy": "human",
    "validFrom": "2026-01-01",
    "validUntil": "2026-12-31",
    "updateFrequency": "annual",
    "status": "active"
  },
  {
    "id": "GT-41110-B08-youth-age",
    "unitId": "lg-41110",
    "questionId": "V1-B08-02",
    "category": "youth_rent",
    "value": "만 19세~39세",
    "valueType": "numeric",
    "acceptableVariants": ["만19~39세", "19세~39세", "만 19세 이상 39세 이하", "19-39세", "만 19세~39세"],
    "sourceUrl": "https://www.suwon.go.kr",
    "sourceOrg": "수원시청",
    "verifiedAt": "2026-09-07",
    "verifiedBy": "human",
    "validFrom": "2026-01-01",
    "validUntil": "2026-12-31",
    "updateFrequency": "annual",
    "status": "active"
  },
  {
    "id": "GT-41110-B08-youth-income",
    "unitId": "lg-41110",
    "questionId": "V1-B08-03",
    "category": "youth_rent",
    "value": "기준 중위소득 150% 이하",
    "valueType": "numeric",
    "acceptableVariants": ["중위소득 150%", "중위소득 150% 이하", "150% 이하", "150%"],
    "sourceUrl": "https://www.suwon.go.kr",
    "sourceOrg": "수원시청",
    "verifiedAt": "2026-09-07",
    "verifiedBy": "human",
    "validFrom": "2026-01-01",
    "validUntil": "2026-12-31",
    "updateFrequency": "annual",
    "status": "active"
  },
  {
    "id": "GT-41110-B10-night-care-tel",
    "unitId": "lg-41110",
    "questionId": "V1-B10-01",
    "category": "night_care",
    "value": "031-8008-8282",
    "valueType": "numeric",
    "acceptableVariants": ["031-8008-8282", "03180088282"],
    "sourceUrl": "https://www.suwon.go.kr",
    "sourceOrg": "수원시청",
    "verifiedAt": "2026-09-07",
    "verifiedBy": "human",
    "validFrom": "2026-01-01",
    "validUntil": "2026-12-31",
    "updateFrequency": "annual",
    "status": "active"
  },
  {
    "id": "GT-41110-B10-night-pharmacy-tel",
    "unitId": "lg-41110",
    "questionId": "V1-B10-02",
    "category": "night_care",
    "value": "1644-0723",
    "valueType": "numeric",
    "acceptableVariants": ["1644-0723", "16440723"],
    "sourceUrl": "https://www.suwon.go.kr",
    "sourceOrg": "수원시청",
    "verifiedAt": "2026-09-07",
    "verifiedBy": "human",
    "validFrom": "2026-01-01",
    "validUntil": "2026-12-31",
    "updateFrequency": "annual",
    "status": "active"
  },
  {
    "id": "GT-41110-B15-festival-date",
    "unitId": "lg-41110",
    "questionId": "V1-B15-01",
    "category": "festival",
    "value": "10월",
    "valueType": "date",
    "acceptableVariants": ["10월", "매년 10월", "10월경"],
    "sourceUrl": "https://www.swcf.or.kr",
    "sourceOrg": "수원문화재단",
    "verifiedAt": "2026-09-07",
    "verifiedBy": "human",
    "validFrom": "2026-01-01",
    "validUntil": "2026-12-31",
    "updateFrequency": "annual",
    "status": "active"
  },
  {
    "id": "GT-41110-B15-haenggung-admission",
    "unitId": "lg-41110",
    "questionId": "V1-B15-02",
    "category": "festival",
    "value": "1,500원",
    "valueType": "numeric",
    "acceptableVariants": ["1,500원", "1500원", "1,500", "1500"],
    "sourceUrl": "https://www.swcf.or.kr",
    "sourceOrg": "수원문화재단",
    "verifiedAt": "2026-09-07",
    "verifiedBy": "human",
    "validFrom": "2026-01-01",
    "validUntil": "2026-12-31",
    "updateFrequency": "annual",
    "status": "active"
  }
]
