[
  {
    "id": "GT-43745-B01-birth-2nd",
    "unitId": "lg-43745",
    "questionId": "V1-B01-01",
    "category": "birth",
    "value": "300만원",
    "valueType": "numeric",
    "acceptableVariants": ["300만", "3000000", "삼백만", "300만원"],
    "sourceUrl": "https://www.jp.go.kr",
    "sourceOrg": "증평군청",
    "verifiedAt": "2026-09-07",
    "verifiedBy": "human",
    "validFrom": "2026-01-01",
    "validUntil": "2026-12-31",
    "updateFrequency": "annual",
    "status": "active"
  },
  {
    "id": "GT-43745-B01-birth-1st",
    "unitId": "lg-43745",
    "questionId": "V1-B01-02",
    "category": "birth",
    "value": "100만원",
    "valueType": "numeric",
    "acceptableVariants": ["100만", "1000000", "백만", "100만원"],
    "sourceUrl": "https://www.jp.go.kr",
    "sourceOrg": "증평군청",
    "verifiedAt": "2026-09-07",
    "verifiedBy": "human",
    "validFrom": "2026-01-01",
    "validUntil": "2026-12-31",
    "updateFrequency": "annual",
    "status": "active"
  },
  {
    "id": "GT-43745-B01-birth-3rd",
    "unitId": "lg-43745",
    "questionId": "V1-B01-03",
    "category": "birth",
    "value": "500만원",
    "valueType": "numeric",
    "acceptableVariants": ["500만", "5000000", "오백만", "500만원"],
    "sourceUrl": "https://www.jp.go.kr",
    "sourceOrg": "증평군청",
    "verifiedAt": "2026-09-07",
    "verifiedBy": "human",
    "validFrom": "2026-01-01",
    "validUntil": "2026-12-31",
    "updateFrequency": "annual",
    "status": "active"
  },
  {
    "id": "GT-43745-B04-waste-20l",
    "unitId": "lg-43745",
    "questionId": "V1-B04-01",
    "category": "waste_bag",
    "value": "450원",
    "valueType": "numeric",
    "acceptableVariants": ["450", "450원", "사백오십원"],
    "sourceUrl": "https://www.jp.go.kr",
    "sourceOrg": "증평군청",
    "verifiedAt": "2026-09-07",
    "verifiedBy": "human",
    "validFrom": "2026-01-01",
    "validUntil": "2026-12-31",
    "updateFrequency": "annual",
    "status": "active"
  },
  {
    "id": "GT-43745-B04-waste-10l",
    "unitId": "lg-43745",
    "questionId": "V1-B04-02",
    "category": "waste_bag",
    "value": "270원",
    "valueType": "numeric",
    "acceptableVariants": ["270", "270원", "이백칠십원"],
    "sourceUrl": "https://www.jp.go.kr",
    "sourceOrg": "증평군청",
    "verifiedAt": "2026-09-07",
    "verifiedBy": "human",
    "validFrom": "2026-01-01",
    "validUntil": "2026-12-31",
    "updateFrequency": "annual",
    "status": "active"
  },
  {
    "id": "GT-43745-B04-retailers",
    "unitId": "lg-43745",
    "questionId": "V1-B04-03",
    "category": "waste_bag",
    "value": "읍·면사무소 및 관내 마트·편의점",
    "valueType": "text",
    "acceptableVariants": [
      "읍면사무소·마트",
      "읍면사무소, 마트",
      "증평읍사무소, 도안면사무소, 마트",
      "읍면사무소",
      "마트"
    ],
    "sourceUrl": "https://www.jp.go.kr",
    "sourceOrg": "증평군청",
    "verifiedAt": "2026-09-07",
    "verifiedBy": "human",
    "validFrom": "2026-01-01",
    "validUntil": "2026-12-31",
    "updateFrequency": "annual",
    "status": "active"
  },
  {
    "id": "GT-43745-B06-senior-age",
    "unitId": "lg-43745",
    "questionId": "V1-B06-01",
    "category": "senior_bus",
    "value": "만 65세 이상",
    "valueType": "numeric",
    "acceptableVariants": ["만 65세", "만65세", "65세", "65세 이상", "만 65세 이상"],
    "sourceUrl": "https://www.jp.go.kr",
    "sourceOrg": "증평군청",
    "verifiedAt": "2026-09-07",
    "verifiedBy": "human",
    "validFrom": "2026-01-01",
    "validUntil": "2026-12-31",
    "updateFrequency": "annual",
    "status": "active"
  },
  {
    "id": "GT-43745-B06-senior-bus-allowance",
    "unitId": "lg-43745",
    "questionId": "V1-B06-02",
    "category": "senior_bus",
    "value": "월 1만원",
    "valueType": "numeric",
    "acceptableVariants": ["월 1만원", "월 1만", "1만원", "10000원", "월1만원"],
    "sourceUrl": "https://www.jp.go.kr",
    "sourceOrg": "증평군청",
    "verifiedAt": "2026-09-07",
    "verifiedBy": "human",
    "validFrom": "2026-01-01",
    "validUntil": "2026-12-31",
    "updateFrequency": "annual",
    "status": "active"
  },
  {
    "id": "GT-43745-B08-youth-rent-amount",
    "unitId": "lg-43745",
    "questionId": "V1-B08-01",
    "category": "youth_rent",
    "value": "월 최대 15만원",
    "valueType": "numeric",
    "acceptableVariants": ["월 15만원", "월15만원", "15만원", "150000원", "월 최대 15만원"],
    "sourceUrl": "https://www.jp.go.kr",
    "sourceOrg": "증평군청",
    "verifiedAt": "2026-09-07",
    "verifiedBy": "human",
    "validFrom": "2026-01-01",
    "validUntil": "2026-12-31",
    "updateFrequency": "annual",
    "status": "active"
  },
  {
    "id": "GT-43745-B08-youth-age",
    "unitId": "lg-43745",
    "questionId": "V1-B08-02",
    "category": "youth_rent",
    "value": "만 19세~34세",
    "valueType": "numeric",
    "acceptableVariants": ["만19~34세", "19세~34세", "만 19세 이상 34세 이하", "19-34세", "만 19세~34세"],
    "sourceUrl": "https://www.jp.go.kr",
    "sourceOrg": "증평군청",
    "verifiedAt": "2026-09-07",
    "verifiedBy": "human",
    "validFrom": "2026-01-01",
    "validUntil": "2026-12-31",
    "updateFrequency": "annual",
    "status": "active"
  },
  {
    "id": "GT-43745-B08-youth-rent-period",
    "unitId": "lg-43745",
    "questionId": "V1-B08-03",
    "category": "youth_rent",
    "value": "최대 24개월",
    "valueType": "numeric",
    "acceptableVariants": ["최대 24개월", "24개월", "2년", "최대 2년", "24달"],
    "sourceUrl": "https://www.jp.go.kr",
    "sourceOrg": "증평군청",
    "verifiedAt": "2026-09-07",
    "verifiedBy": "human",
    "validFrom": "2026-01-01",
    "validUntil": "2026-12-31",
    "updateFrequency": "annual",
    "status": "active"
  },
  {
    "id": "GT-43745-B10-medical-center-tel",
    "unitId": "lg-43745",
    "questionId": "V1-B10-01",
    "category": "night_care",
    "value": "043-835-4000",
    "valueType": "numeric",
    "acceptableVariants": ["043-835-4000", "0438354000"],
    "sourceUrl": "https://www.jp.go.kr",
    "sourceOrg": "증평군청",
    "verifiedAt": "2026-09-07",
    "verifiedBy": "human",
    "validFrom": "2026-01-01",
    "validUntil": "2026-12-31",
    "updateFrequency": "annual",
    "status": "active"
  },
  {
    "id": "GT-43745-B10-emergency-guide",
    "unitId": "lg-43745",
    "questionId": "V1-B10-02",
    "category": "night_care",
    "value": "관내 응급실 부재로 인근 청주·괴산 종합병원 응급의료센터 이용",
    "valueType": "text",
    "acceptableVariants": [
      "인근 청주/괴산 응급실 이용",
      "청주 효성병원·괴산성모병원 등 인근 응급실 연계",
      "인근 지역 응급실 이용",
      "청주·괴산 응급의료센터 이용"
    ],
    "sourceUrl": "https://www.jp.go.kr",
    "sourceOrg": "증평군청",
    "verifiedAt": "2026-09-07",
    "verifiedBy": "human",
    "validFrom": "2026-01-01",
    "validUntil": "2026-12-31",
    "updateFrequency": "annual",
    "status": "active"
  },
  {
    "id": "GT-43745-B15-festival-date",
    "unitId": "lg-43745",
    "questionId": "V1-B15-01",
    "category": "festival",
    "value": "10월",
    "valueType": "date",
    "acceptableVariants": ["10월", "매년 10월", "10월경"],
    "sourceUrl": "https://www.jp.go.kr",
    "sourceOrg": "증평군청",
    "verifiedAt": "2026-09-07",
    "verifiedBy": "human",
    "validFrom": "2026-01-01",
    "validUntil": "2026-12-31",
    "updateFrequency": "annual",
    "status": "active"
  },
  {
    "id": "GT-43745-B15-festival-location-fee",
    "unitId": "lg-43745",
    "questionId": "V1-B15-02",
    "category": "festival",
    "value": "보강천 미루나무숲 일원, 입장료 무료",
    "valueType": "text",
    "acceptableVariants": [
      "보강천변, 무료",
      "보강천변 무료",
      "보강천 미루나무숲, 무료",
      "보강천변",
      "무료"
    ],
    "sourceUrl": "https://www.jp.go.kr",
    "sourceOrg": "증평군청",
    "verifiedAt": "2026-09-07",
    "verifiedBy": "human",
    "validFrom": "2026-01-01",
    "validUntil": "2026-12-31",
    "updateFrequency": "annual",
    "status": "active"
  }
]
